[
  {
    "provider": "openai",
    "model_id": "gpt-5.5",
    "display_name": "GPT-5.5",
    "status": "ga",
    "release_date": null,
    "deprecation_date": null,
    "retirement_date": null,
    "pricing": {
      "input_per_mtok": 5.0,
      "output_per_mtok": 30.0,
      "cached_input_per_mtok": 0.5,
      "batch_discount_pct": null
    },
    "context_window_tokens": 1050000,
    "max_output_tokens": 128000,
    "modalities": {
      "input": [
        "text",
        "image"
      ],
      "output": [
        "text"
      ]
    },
    "knowledge_cutoff": "Dec 01, 2025",
    "sources": [
      {
        "url": "https://developers.openai.com/api/docs/pricing",
        "accessed_at": "2026-07-04T05:55:32Z",
        "fields": [
          "pricing.input_per_mtok",
          "pricing.output_per_mtok",
          "pricing.cached_input_per_mtok"
        ],
        "quote": "gpt-5.5$5.00$0.50$30.00$10.00$1.00$45.00"
      },
      {
        "url": "https://developers.openai.com/api/docs/models/compare",
        "accessed_at": "2026-07-04T05:55:32Z",
        "fields": [
          "context_window_tokens",
          "max_output_tokens",
          "knowledge_cutoff",
          "modalities"
        ],
        "quote": "GPT-5.5 ... Input $5.00 Cached Input $0.50 Output $30.00 Context Window 1,050,000 Max Output Tokens 128,000 Knowledge Cutoff Dec 01, 2025 Supported Features Streaming Function calling Structured outputs Image input"
      }
    ],
    "verified_at": "2026-07-04T05:55:32Z",
    "notes": "OpenAI pricing records the standard short-context tier; long-context pricing, where present, is noted in the cited quote."
  },
  {
    "provider": "openai",
    "model_id": "gpt-5.5-pro",
    "display_name": "GPT-5.5 Pro",
    "status": "ga",
    "release_date": null,
    "deprecation_date": null,
    "retirement_date": null,
    "pricing": {
      "input_per_mtok": 30.0,
      "output_per_mtok": 180.0,
      "cached_input_per_mtok": null,
      "batch_discount_pct": null
    },
    "context_window_tokens": 1050000,
    "max_output_tokens": 128000,
    "modalities": {
      "input": [
        "text",
        "image"
      ],
      "output": [
        "text"
      ]
    },
    "knowledge_cutoff": "Dec 01, 2025",
    "sources": [
      {
        "url": "https://developers.openai.com/api/docs/pricing",
        "accessed_at": "2026-07-04T05:55:32Z",
        "fields": [
          "pricing.input_per_mtok",
          "pricing.output_per_mtok"
        ],
        "quote": "gpt-5.5-pro$30.00-$180.00$60.00-$270.00"
      },
      {
        "url": "https://developers.openai.com/api/docs/models/compare",
        "accessed_at": "2026-07-04T05:55:32Z",
        "fields": [
          "context_window_tokens",
          "max_output_tokens",
          "knowledge_cutoff",
          "modalities"
        ],
        "quote": "GPT-5.5 Pro ... Input $30.00 Cached Input - Output $180.00 Context Window 1,050,000 Max Output Tokens 128,000 Knowledge Cutoff Dec 01, 2025 Supported Features Streaming Function calling Structured outputs Image input"
      }
    ],
    "verified_at": "2026-07-04T05:55:32Z",
    "notes": "OpenAI pricing records the standard short-context tier; long-context pricing, where present, is noted in the cited quote."
  },
  {
    "provider": "openai",
    "model_id": "gpt-5.4",
    "display_name": "GPT-5.4",
    "status": "ga",
    "release_date": null,
    "deprecation_date": null,
    "retirement_date": null,
    "pricing": {
      "input_per_mtok": 2.5,
      "output_per_mtok": 15.0,
      "cached_input_per_mtok": 0.25,
      "batch_discount_pct": null
    },
    "context_window_tokens": 1050000,
    "max_output_tokens": 128000,
    "modalities": {
      "input": [
        "text",
        "image"
      ],
      "output": [
        "text"
      ]
    },
    "knowledge_cutoff": "Aug 31, 2025",
    "sources": [
      {
        "url": "https://developers.openai.com/api/docs/pricing",
        "accessed_at": "2026-07-04T05:55:32Z",
        "fields": [
          "pricing.input_per_mtok",
          "pricing.output_per_mtok",
          "pricing.cached_input_per_mtok"
        ],
        "quote": "gpt-5.4$2.50$0.25$15.00$5.00$0.50$22.50"
      },
      {
        "url": "https://developers.openai.com/api/docs/models/compare",
        "accessed_at": "2026-07-04T05:55:32Z",
        "fields": [
          "context_window_tokens",
          "max_output_tokens",
          "knowledge_cutoff",
          "modalities"
        ],
        "quote": "GPT-5.4 ... Input $2.50 Cached Input $0.25 Output $15.00 Context Window 1,050,000 Max Output Tokens 128,000 Knowledge Cutoff Aug 31, 2025 Supported Features Streaming Function calling Structured outputs Image input"
      }
    ],
    "verified_at": "2026-07-04T05:55:32Z",
    "notes": "OpenAI pricing records the standard short-context tier; long-context pricing, where present, is noted in the cited quote."
  },
  {
    "provider": "anthropic",
    "model_id": "claude-fable-5",
    "display_name": "Claude Fable 5",
    "status": "ga",
    "release_date": null,
    "deprecation_date": null,
    "retirement_date": null,
    "pricing": {
      "input_per_mtok": 10,
      "output_per_mtok": 50,
      "cached_input_per_mtok": 1,
      "batch_discount_pct": null
    },
    "context_window_tokens": 1000000,
    "max_output_tokens": 128000,
    "modalities": {
      "input": [
        "text",
        "image"
      ],
      "output": [
        "text"
      ]
    },
    "knowledge_cutoff": "Jan 2026",
    "sources": [
      {
        "url": "https://platform.claude.com/docs/en/about-claude/pricing",
        "accessed_at": "2026-07-04T05:55:32Z",
        "fields": [
          "pricing.input_per_mtok",
          "pricing.output_per_mtok",
          "pricing.cached_input_per_mtok"
        ],
        "quote": "Claude Fable 5$10 / MTok$12.50 / MTok$20 / MTok$1 / MTok$50 / MTok Claude Opus 4.8$5 / MTok$6.25 / MTok$10 / MTok$0.50 / MTok$25 / MTok Claude Opus 4.7$5 / MTok$6.25 / MTok$10 / MTok$0.50 / MTok$25 / MTok Claude Opus 4.6$5 / MTok$6.25 / MTok$10 / MTok$0.50 / MTok$25 / MTok Claude Sonnet 5 through August 31, 2026 $2 / MTok$2.50 / MTok$4 / MTok$0.20 / MTok$10 / MTok Claude Haiku 4.5$1 / MTok$1.25 / MTok$2 / MTok$0.10 / MTok$5 / MTok"
      },
      {
        "url": "https://platform.claude.com/docs/en/about-claude/models/overview",
        "accessed_at": "2026-07-04T05:55:32Z",
        "fields": [
          "modalities"
        ],
        "quote": "All current Claude models support text and image input, text output, multilingual capabilities, and vision."
      },
      {
        "url": "https://platform.claude.com/docs/en/about-claude/models/overview",
        "accessed_at": "2026-07-04T05:55:32Z",
        "fields": [
          "model_id",
          "context_window_tokens",
          "max_output_tokens",
          "knowledge_cutoff"
        ],
        "quote": "Claude API ID claude-fable-5 claude-opus-4-8 claude-sonnet-5 claude-haiku-4-5-20251001 ... Context window 1M tokens 1M tokens 1M tokens 200k tokens Max output 128k tokens 128k tokens 128k tokens 64k tokens Reliable knowledge cutoff Jan 2026 Jan 2026 Jan 2026 Feb 2025"
      }
    ],
    "verified_at": "2026-07-04T05:55:32Z",
    "notes": null
  },
  {
    "provider": "anthropic",
    "model_id": "claude-opus-4-8",
    "display_name": "Claude Opus 4.8",
    "status": "ga",
    "release_date": null,
    "deprecation_date": null,
    "retirement_date": null,
    "pricing": {
      "input_per_mtok": 5,
      "output_per_mtok": 25,
      "cached_input_per_mtok": 0.5,
      "batch_discount_pct": null
    },
    "context_window_tokens": 1000000,
    "max_output_tokens": 128000,
    "modalities": {
      "input": [
        "text",
        "image"
      ],
      "output": [
        "text"
      ]
    },
    "knowledge_cutoff": "Jan 2026",
    "sources": [
      {
        "url": "https://platform.claude.com/docs/en/about-claude/pricing",
        "accessed_at": "2026-07-04T05:55:32Z",
        "fields": [
          "pricing.input_per_mtok",
          "pricing.output_per_mtok",
          "pricing.cached_input_per_mtok"
        ],
        "quote": "Claude Fable 5$10 / MTok$12.50 / MTok$20 / MTok$1 / MTok$50 / MTok Claude Opus 4.8$5 / MTok$6.25 / MTok$10 / MTok$0.50 / MTok$25 / MTok Claude Opus 4.7$5 / MTok$6.25 / MTok$10 / MTok$0.50 / MTok$25 / MTok Claude Opus 4.6$5 / MTok$6.25 / MTok$10 / MTok$0.50 / MTok$25 / MTok Claude Sonnet 5 through August 31, 2026 $2 / MTok$2.50 / MTok$4 / MTok$0.20 / MTok$10 / MTok Claude Haiku 4.5$1 / MTok$1.25 / MTok$2 / MTok$0.10 / MTok$5 / MTok"
      },
      {
        "url": "https://platform.claude.com/docs/en/about-claude/models/overview",
        "accessed_at": "2026-07-04T05:55:32Z",
        "fields": [
          "modalities"
        ],
        "quote": "All current Claude models support text and image input, text output, multilingual capabilities, and vision."
      },
      {
        "url": "https://platform.claude.com/docs/en/about-claude/models/overview",
        "accessed_at": "2026-07-04T05:55:32Z",
        "fields": [
          "model_id",
          "context_window_tokens",
          "max_output_tokens",
          "knowledge_cutoff"
        ],
        "quote": "Claude API ID claude-fable-5 claude-opus-4-8 claude-sonnet-5 claude-haiku-4-5-20251001 ... Context window 1M tokens 1M tokens 1M tokens 200k tokens Max output 128k tokens 128k tokens 128k tokens 64k tokens Reliable knowledge cutoff Jan 2026 Jan 2026 Jan 2026 Feb 2025"
      }
    ],
    "verified_at": "2026-07-04T05:55:32Z",
    "notes": null
  },
  {
    "provider": "anthropic",
    "model_id": "claude-opus-4-7",
    "display_name": "Claude Opus 4.7",
    "status": "ga",
    "release_date": null,
    "deprecation_date": null,
    "retirement_date": null,
    "pricing": {
      "input_per_mtok": 5,
      "output_per_mtok": 25,
      "cached_input_per_mtok": 0.5,
      "batch_discount_pct": null
    },
    "context_window_tokens": 1000000,
    "max_output_tokens": null,